{
  "$schema": "job-reducer-contract.schema.json",
  "contract_version": 1,
  "status": "proposed",
  "authority": "ADR-0002",
  "job_states": [
    "admitted",
    "preparing",
    "running",
    "stopping",
    "finalizing",
    "succeeded",
    "failed",
    "cancelled",
    "terminated",
    "timed_out"
  ],
  "terminal_states": [
    "succeeded",
    "failed",
    "cancelled",
    "terminated",
    "timed_out"
  ],
  "entity_positions": [
    "absent",
    "admitted",
    "preparing",
    "running",
    "stopping",
    "finalizing",
    "succeeded",
    "failed",
    "cancelled",
    "terminated",
    "timed_out"
  ],
  "command_kinds": [
    "cancel",
    "terminate"
  ],
  "journal_event_kinds": [
    "job_created",
    "resources_committed",
    "worker_launch_intent",
    "worker_launch_observed",
    "worker_running",
    "cancel_accepted",
    "terminate_accepted",
    "timeout_expired",
    "worker_completed",
    "worker_failed",
    "process_exit_confirmed",
    "session_retain_requested",
    "session_retained",
    "finalization_completed",
    "finalization_failed",
    "terminal_outcome_committed",
    "resources_released",
    "cleanup_status_recorded",
    "late_worker_event"
  ],
  "timeout_phases": [
    "preparation",
    "execution",
    "cooperative_stop",
    "process_exit_confirmation"
  ],
  "terminal_outcomes": [
    "succeeded",
    "failed",
    "cancelled",
    "terminated",
    "timed_out"
  ],
  "dispositions": [
    "transition",
    "audit",
    "late_audit",
    "reject"
  ],
  "rejection_reasons": [
    "job_not_found",
    "job_already_exists",
    "command_not_allowed_in_state",
    "event_not_allowed_in_state",
    "stop_cause_already_latched",
    "timeout_phase_mismatch",
    "terminal_outcome_mismatch",
    "required_finalization_fact_missing",
    "invalid_event_payload",
    "invariant_violation"
  ],
  "post_sync_effects": [
    "arm_preparation_timeout",
    "disarm_preparation_timeout",
    "launch_worker_once",
    "arm_execution_timeout",
    "disarm_execution_timeout",
    "request_cooperative_stop",
    "request_forced_stop",
    "retain_session_same_identity",
    "ack_terminal_worker_event_if_pending",
    "ack_late_worker_event",
    "publish_terminal_result",
    "arm_process_exit_confirmation_timeout_if_needed",
    "quarantine_resources",
    "set_readiness_false",
    "arm_cooperative_stop_timeout",
    "disarm_cooperative_stop_timeout",
    "disarm_process_exit_confirmation_timeout"
  ],
  "command_matrix": [
    {
      "pair_id": "absent__cancel",
      "entity_position": "absent",
      "command_kind": "cancel",
      "cases": [
        {
          "case_id": "rejected",
          "when": {
            "operator": "otherwise"
          },
          "disposition": "reject",
          "rejection_reason": "job_not_found"
        }
      ]
    },
    {
      "pair_id": "absent__terminate",
      "entity_position": "absent",
      "command_kind": "terminate",
      "cases": [
        {
          "case_id": "rejected",
          "when": {
            "operator": "otherwise"
          },
          "disposition": "reject",
          "rejection_reason": "job_not_found"
        }
      ]
    },
    {
      "pair_id": "admitted__cancel",
      "entity_position": "admitted",
      "command_kind": "cancel",
      "cases": [
        {
          "case_id": "accept",
          "when": {
            "operator": "always"
          },
          "disposition": "audit",
          "journal_event_type": "cancel_accepted",
          "journal_payload": {
            "principal_subject": {
              "from": "command.principal_subject"
            }
          }
        }
      ]
    },
    {
      "pair_id": "admitted__terminate",
      "entity_position": "admitted",
      "command_kind": "terminate",
      "cases": [
        {
          "case_id": "accept",
          "when": {
            "operator": "always"
          },
          "disposition": "audit",
          "journal_event_type": "terminate_accepted",
          "journal_payload": {
            "principal_subject": {
              "from": "command.principal_subject"
            }
          }
        }
      ]
    },
    {
      "pair_id": "preparing__cancel",
      "entity_position": "preparing",
      "command_kind": "cancel",
      "cases": [
        {
          "case_id": "accept",
          "when": {
            "operator": "always"
          },
          "disposition": "audit",
          "journal_event_type": "cancel_accepted",
          "journal_payload": {
            "principal_subject": {
              "from": "command.principal_subject"
            }
          }
        }
      ]
    },
    {
      "pair_id": "preparing__terminate",
      "entity_position": "preparing",
      "command_kind": "terminate",
      "cases": [
        {
          "case_id": "accept",
          "when": {
            "operator": "always"
          },
          "disposition": "audit",
          "journal_event_type": "terminate_accepted",
          "journal_payload": {
            "principal_subject": {
              "from": "command.principal_subject"
            }
          }
        }
      ]
    },
    {
      "pair_id": "running__cancel",
      "entity_position": "running",
      "command_kind": "cancel",
      "cases": [
        {
          "case_id": "accept",
          "when": {
            "operator": "always"
          },
          "disposition": "audit",
          "journal_event_type": "cancel_accepted",
          "journal_payload": {
            "principal_subject": {
              "from": "command.principal_subject"
            }
          }
        }
      ]
    },
    {
      "pair_id": "running__terminate",
      "entity_position": "running",
      "command_kind": "terminate",
      "cases": [
        {
          "case_id": "accept",
          "when": {
            "operator": "always"
          },
          "disposition": "audit",
          "journal_event_type": "terminate_accepted",
          "journal_payload": {
            "principal_subject": {
              "from": "command.principal_subject"
            }
          }
        }
      ]
    },
    {
      "pair_id": "stopping__cancel",
      "entity_position": "stopping",
      "command_kind": "cancel",
      "cases": [
        {
          "case_id": "rejected",
          "when": {
            "operator": "otherwise"
          },
          "disposition": "reject",
          "rejection_reason": "stop_cause_already_latched"
        }
      ]
    },
    {
      "pair_id": "stopping__terminate",
      "entity_position": "stopping",
      "command_kind": "terminate",
      "cases": [
        {
          "case_id": "accept_live_process",
          "when": {
            "operator": "all",
            "predicates": [
              {
                "source": "snapshot",
                "field": "process_exit_confirmed",
                "operator": "eq",
                "value": false
              }
            ]
          },
          "disposition": "audit",
          "journal_event_type": "terminate_accepted",
          "journal_payload": {
            "principal_subject": {
              "from": "command.principal_subject"
            }
          }
        },
        {
          "case_id": "already_exited",
          "when": {
            "operator": "otherwise"
          },
          "disposition": "reject",
          "rejection_reason": "command_not_allowed_in_state"
        }
      ]
    },
    {
      "pair_id": "finalizing__cancel",
      "entity_position": "finalizing",
      "command_kind": "cancel",
      "cases": [
        {
          "case_id": "rejected",
          "when": {
            "operator": "otherwise"
          },
          "disposition": "reject",
          "rejection_reason": "command_not_allowed_in_state"
        }
      ]
    },
    {
      "pair_id": "finalizing__terminate",
      "entity_position": "finalizing",
      "command_kind": "terminate",
      "cases": [
        {
          "case_id": "accept_live_process",
          "when": {
            "operator": "all",
            "predicates": [
              {
                "source": "snapshot",
                "field": "process_exit_confirmed",
                "operator": "eq",
                "value": false
              }
            ]
          },
          "disposition": "audit",
          "journal_event_type": "terminate_accepted",
          "journal_payload": {
            "principal_subject": {
              "from": "command.principal_subject"
            }
          }
        },
        {
          "case_id": "already_exited",
          "when": {
            "operator": "otherwise"
          },
          "disposition": "reject",
          "rejection_reason": "command_not_allowed_in_state"
        }
      ]
    },
    {
      "pair_id": "succeeded__cancel",
      "entity_position": "succeeded",
      "command_kind": "cancel",
      "cases": [
        {
          "case_id": "rejected",
          "when": {
            "operator": "otherwise"
          },
          "disposition": "reject",
          "rejection_reason": "command_not_allowed_in_state"
        }
      ]
    },
    {
      "pair_id": "succeeded__terminate",
      "entity_position": "succeeded",
      "command_kind": "terminate",
      "cases": [
        {
          "case_id": "rejected",
          "when": {
            "operator": "otherwise"
          },
          "disposition": "reject",
          "rejection_reason": "command_not_allowed_in_state"
        }
      ]
    },
    {
      "pair_id": "failed__cancel",
      "entity_position": "failed",
      "command_kind": "cancel",
      "cases": [
        {
          "case_id": "rejected",
          "when": {
            "operator": "otherwise"
          },
          "disposition": "reject",
          "rejection_reason": "command_not_allowed_in_state"
        }
      ]
    },
    {
      "pair_id": "failed__terminate",
      "entity_position": "failed",